Title,Content
"New 'Indigenous Voices' podcast connects Northwest's people, land, and history","A new podcast from Fort Nisqually Living History Museum is all about Northwest stories told by Indigenous voices. Like so many thing silver linings of the past few years, it came about partly because of pandemic-inspired online programming created by museum staffer Elizabeth Rudrud.“We were really looking to find ways to continue to engage our audiences, to make sure we’re providing value for our community,” Rudrud told KIRO Newsradio. “And it really was an opportunity to just stop and re-evaluate [and] pivot.”“Fort Nisqually, being established here in 1833 in the South Sound, Native American communities were integral to all operations, working and living and purchasing and trading, and just thriving in the Puget Sound when Hudson’s Bay Company came here, so it’s a very important part of the story,” Rudrud said.“I reached out to Charlotte Basch at Puyallup Tribe and had a conversation with her on where can we begin on making sure the story is incorporated in a meaningful way into the museum’s interpretation [and] museum operations,” Rudrud continued. “And she and I identified that to do so really needs intentional effort … it needs to be something that’s not an afterthought.”“If there was an opportunity to really focus in and create this platform for tribal voices to tell the history of the Puget Sound that would be the way to go. And she connected us all of us together.”The new monthly podcast is called “Indigenous Voices” and it debuted in February via most podcast platforms. The event that inspired it – a result of the conversation between Elizabeth Rudrud and Charlotte Basch – was produced a year ago. Panelists included members of the Muckleshoot, Nisqually, Puyallup, Steilacoom and Squaxin Island Tribes.That March 2021 online panel discussion was moderated by well-known author and historian Jennifer Ott. Topic for the discussion was what’s called the “1855-1856 Treaty War” – which included death and destruction in Seattle and the White River Valley, and which was precipitated by a U.S. government document: the Treaty of Medicine Creek from December 26, 1854.KIRO Newsradio has presented elements of this history before – such as the actions and missteps of Territorial Governor Isaac Stevens to enforce multiple treaties and remove Indigenous people to reservations to make way for settlers, and the criminal prosecution and execution of Indigenous people, including Leschi, who were clearly Treaty War combatants and not criminals. Those earlier radio and web stories have often included the voices of Indigenous people; failure to do so would be inexcusable, and the depth, breadth and accuracy of the stories would suffer.However, the panel at Point Defiance last March and the new podcast are qualitatively different and better by several orders of magnitude: both feature tribal people talking at length about that brutal time in Northwest history and how it has been understood within multiple tribal communities.The 1850s were a formative era for the place in which we all now live, and decisions made and official policies first enforced then affect each of us every day. And, though it also really wasn’t that long ago, it is an era which is still often mischaracterized and misunderstood, if not completely overlooked.“There have been a number of narratives,” Warren KingGeorge of the Muckleshoot Tribe told KIRO Newsradio earlier this month. KingGeorge took part in the panel last year and was the first member of the group to suggest creating a podcast.“There have been a number of explanations and number of versions of this story of the Medicine Creek Treaty being told,” KingGeorge continued. “But in my opinion, I think this would have been the first time that a consortium of representatives and descendants from the Medicine Creek Treaty came together and had a conversation that involved the history of our people and of this state of Washington.”Danny Marshall, chair of the Steilacoom Tribe, is also a panelist and podcast participant. He says the 168-year-old treaty is a “forever document” which is still in effect, and which still has a profound impact on this area’s people and culture.“You can go online and pull up a copy of the Medicine Creek Treaty, signed in 1854, and see what it says in it,” Marshall said. “That’s eye-opening for many people, just listing the tribes that are on there, [and] many can’t be located today.”“And then also the promises that were made within the treaty, and realizing that many of those promises were never kept,” Marshall continued. “So, why is it important? Because it’s a forever document. It’s not one of those things that was signed between the tribal people and the government to be just a mode of operation for the day, but it was to guide us into the future.”“There have been many different ways the government has guided this into the future and kind of taken new directions. With always one potential goal which was assimilation and enculturation of the Indian people into the communities that they were planning to develop.”“It really didn’t go as planned,” Marshall continued. “The whole genesis of the history of Washington state has been things didn’t go as the president initially intended. Franklin Pierce sent [Isaac] Stevens out here to negotiate these treaties with one purpose in mind: set up one reservation for all the Indian people to be contained, and then develop opportunities for American [non-Native] communities to be settled here in the area.”The people and voices taking part in the Fort Nisqually project effectively take what can seem to some like a distant and abstract history and make it concrete, real, and, especially, human scaled. Listening to the podcast, what once may have been a few pages in a state-approved curriculum from the 1970s becomes an inspiring story about a community of multiple generations defending their homeland. In this regard, the 1850s in the lower reaches of what the Europeans first called Puget Sound or the White River Valley have emotional parallels to what’s taking place in Ukraine in 2022.And because the subject is war and the social and political conditions that led to deadly encounters, these are not exactly lightweight discussions.Warren KingGeorge says the conversations for the panels and the podcast episodes have sometimes created moments that were difficult, uncomfortable, and even powerful.“We can try to imagine what some of the emotions that we’re going through our ancestors’ minds at that time and in their hearts, the perspective of someone who’s willing to lay down their life and fight for what they believe in to their death,” KingGeorge said. “That we don’t want to move our people here. We don’t want to give up these resources there. We want to retain our homeland, the place that we feel most comfortable.”“We’re willing to fight for it to our last breath,” KingGeorge continued. “And sometimes that can get a little emotional, when you’re trying to explain to somebody why it is Native Americans feel the way they do about their homelands [and] about their traditional territory.”On a personal note, as a journalist and historian, one thing I often feel when I talk to an Indigenous person with deep roots here is that, in spite of my best intentions, I remain ignorant about Indigenous culture and history. Though I have read much of the material about this history (most of it written by white people, of course) and have traveled extensively around the region and paid close attention to the stories, I’m always afraid I’m going to say something clumsy or unintentionally offensive.Danny Marshall says those feelings are not uncommon. But, he says the Fort Nisqually panel discussions and the new podcast might help address this phenomenon by giving people an opportunity to become more knowledgeable.“[This projects] makes the public more comfortable with what they don’t know and gives them an opportunity to try and reach out and get more information,” Marshall said. “[Or] at least feel comfortable asking the questions when they come to our museum, so they’re not saying, ‘I’m the dumb person really doesn’t know anything. I’m afraid to ask something so I don’t want to offend anybody’ but [instead], ‘Here’s my question.’”“And then we have these great conversations,” Marshall said, pointing to noticeable changes he’s seen in Steilacoom in just the past year. “We’ve experienced that already – people will come in and say ‘Yeah, we saw the YouTube video that was podcast on the treaty panel, and we wanted to come in and visit and talk more about it.’”And what about something as simple – and complex – as what words are used to name or describe Northwest residents with roots going back thousands of years? It’s easy for anyone to stumble and get confused by the differences – or appropriateness – of knowing when to “Indian,” “American Indian,” “Native,” “Native American” or “Indigenous.”Marshall suggests a simple approach.“If you really want to get personal on this, we just identify ourselves as people,” Marshall said. “And sometimes I’ll identify us as ‘people,’ and the other people as ‘the new people.’”“It’s easy, because everybody is people,” he continued. “And they’re people here in the area. And you love it because you’ve spent your life here … [and] we’ve got stories that have been passed down generation after generation within our communities that that tie us even stronger to the land. But there’s space for [both].”With projects like the “Indigenous Voices” podcast and the other programs at Fort Nisqually, one can’t help but feel a sense of hope for even more understanding.Marshall agrees, and says it’s clear that all of us who live here now truly love the land, regardless of how long our families have been here. And while Indigenous people have a longer and deeper connection, this shared love of the land can be the foundation, Marshall believes, of a lot of understanding and progress.“This is a beautiful place with so much that makes us connected to the area that we can all love and share,” Marshall said. “We haven’t shared well over time, but we can.”In addition the podcast and panel discussions, Elizabeth Rudrud says they are also working on creating an accompanying curriculum which will ultimately be made available to educators around the region.You can hear Feliks every Wednesday and Friday morning on Seattle’s Morning News, read more from him here, and subscribe to The Resident Historian Podcast here. If you have a story idea or a question about Northwest history, please email Feliks here."
Autism spectrum disorders underdiagnosed in Indigenous people,"Six Nations is one of many Indigenous communities across Canada where autism spectrum disorders (ASD) are underdiagnosed.Jacqueline Smith, Program Supervisor at Six Nations Child and Youth, says diagnostic rates are lower here even though statistics are scarce on the reserve.“We do not have specific stats but we do know that there is an underrepresentation in this community compared to children identified/diagnoses in surrounding areas,” said Smith. “This is one of the main reasons why we are expanding our programs on Six Nations to ensure we are able to support children with ASD and their families.”This Saturday, April 2, marks annual World Autism Awareness Day.There is no dedicated autism support program at Six Nations Health Services – yet.The team at Six Nations Health is working with Autism Ontario to increase programming on the reserve to help people with ASD.Autism Spectrum Disorder refers to a range of symptoms that can affect a person emotionally, intellectually, socially and behaviourally. People with ASD can have interpersonal difficulties, trouble recognizing social cues others take for granted, rigid behaviour patterns and obsessions with routine or certain subjects, dislike socializing, refuse to make eye contact, and engage in “stimming” behaviours (self-stimulation) such as hand-flapping, rocking back and forth and humming, among a host of other symptoms. They can also be overwhelmed by too much sensory input, via sight, sound, taste, touch, etc.Some people with ASD are completely non-verbal (unable to speak), while others on the spectrum can have advanced language skills and a higher-than-average intellect. That’s why it’s a spectrum, as autism-type symptoms can manifest so broadly among different people.Some famous people who have ASD include Jerry Seinfeld, Carl Sagan, Sir Isaac Newton, and Mozart, to name a few.Some require intensive, daily support in the home and school, while others live independently.Smith said Six Nations is soon going to be rolling out new autism services to complement the existing services for youth with ASD on the reserve.“We are looking to expand programs connected to the Ontario Autism Program,” she said, with more updates on what those programs will look like to come.Currently, there are no diagnostic services for young people with ASD on Six Nations. Those suspected to be on the spectrum are referred off-reserve for a diagnosis, and that’s something the health team at Six Nations Child and Youth can help families with, said Smith.“Besides that, we do offer services through Six Nations of the Grand River that support children with Autism Spectrum Disorder, for example, case management, speech, occupational therapy, etc.,” she said. “We would connect families with resources within the community and surrounding communities. If there is an unmet need, we can connect with Jordan’s Principle, as well.”To connect with supports through the Child and Youth Health Team please email oapinformation@sixnations.ca or call 519-445-4983."
Budget ignores Indigenous people: Greens,"Greens Senator Dorinda Cox has taken a swipe at the federal budget as a ""last-ditch play for votes""."
Climate crisis: Indigenous groups both victims and saviours,"Indigenous communities are increasingly being recognised as important voices in the global response to climate changeParis (AFP) – Long portrayed as victims of climate change, indigenous peoples who have struggled for years to protect ancestral lands and ways of life from destruction are finally being recognised as playing an important role in defending precious environments.Advertising Read more""In the face of climatic, economic and health catastrophes, reality forces the recognition of indigenous peoples' knowledge, and a new relationship of respect,"" said Gregorio Mirabal, head of the COICA indigenous organisation.""Now we are not victims, we are the solution!""That message was reinforced in a sweeping report by UN climate experts on the impacts and adaptation to global warming, released on Monday, that outlined in harrowing detail the challenges facing humanity and the planet they depend upon for survival.It highlights that many indigenous peoples are on the frontlines of global warming, such as those in the Arctic whose communities and traditions are threatened by melting sea ice and rising waters.But it also underscores what these communities and their intimate knowledge of nature -- transmitted from generation to generation -- can bring to the fight against climate change, in particular to limiting its impacts.That is crucial since indigenous communities, who number less than half a billion people worldwide, steward land home to 80 percent of Earth's remaining biodiversity, notes the IPCC.From the Amazon to Siberia, these communities have been forced to develop methods of coping with external challenges ""for centuries and have developed strategies for resilience in changing environments that can enrich and strengthen other adaptation efforts"", it said.A major cause of their vulnerability acknowledged for the first time by the IPCC in this report is colonialism.""I think it's a huge advancement,"" said Sherilee Harper, of the University of Alberta, Canada, adding that this is a crucial context that helps not only understand the problems facing indigenous groups, but also to frame solutions.Harper was among the authors of the IPCC report, which also included indigenous contributors and peer reviewers for the first time.Previously, she told AFP, ""there was a tendency to paint them as victims of climate change"" without the agency to act.""Of course, that is not true.""- 'Arrogance' -Indigenous groups have welcomed the IPCC's recognition of ancestral knowledge, but say the situation requires more than words.""We need to come up with some kind of action-oriented strategy,"" said Rodion Sulyandziga, of the International Indigenous Peoples Forum on Climate Change.""We need to combine all our efforts. We can bring to the table indigenous knowledge not just on prevention, but on new technology too.""Crucially, leveraging traditional knowledge for adapting to climate change depends on restoring rights to ancestral lands, said Sulyandziga, who represents the Indigenous Udege People of Russia -- Udege means ""forest people"".In Brazil far-right President Jair Bolsonaro has pushed to open protected lands and indigenous reservations to agribusiness and mining MAURO PIMENTEL AFP/File""Without our land, we cannot adapt,"" he said.IPCC scientists also stress the importance of ""self-determination"" and recognising indigenous rights.Chapter after chapter, region after region, the thousands of pages of the report give multiple examples of adaptation practices that could serve as inspiration for the climate threats that scientists warn are already starting to have a severe impact across the world.Take wildfires. Indigenous communities know how to fight fire with fire, burning certain plots at specific times of the year to prevent blazes from getting out of control later.IPCC experts also mention the attention paid to the diversification of crops, like in the agroforestry system of the Kichwas of Ecuador who grow food crops and medicinal plants under the canopy of the Amazon rainforest.Or even the use of traditional knowledge in Fiji to identify endemic plant species that can help limit coastal erosion.Harper said everyone can benefit from learning this wisdom, once people -- especially in the West -- set aside their ""arrogance"".""We have understood for thousands of years when there is balance and imbalance; it is our home and we recognise the limits,"" said COICA's Mirabal.""Our bond with mother nature allows us to take care of what really matters -- water, earth, life.""But the IPCC warned that given the scale of climate change impacts, there are hard limits to adaptation.While some communities may have to leave their homes, others have seen climate change fundamentally alter the land around them such that what was once familiar becomes strange.Like the Inuit communities in and around the Arctic, where warming is faster than almost anywhere on Earth and the once-dependable snow and sea ice are now fragile and fleeting.Ashlee Cunsolo, another author of the IPCC report, said colonialist regimes inflicted terrible injuries over generations -- from the erosion of language and culture to forced relocation.People said they had ""finally entered into this period of indigenous self-determination,"" said Cunsolo. They were ""reclaiming culture"" and lands.""And then climate change comes in.""© 2022 AFP"
Costly and technical reporting: key barriers for Indigenous people in carbon trading,"Costly and technical reporting: key barriers for Indigenous people in carbon tradingOn the sidelines of the UN Convention on Biological Diversity in Geneva, Indigenous peoples leader Jennifer Tauli Corpuz talks to Eco-Business about the challenges of earning from carbon trading in Asia and the Pacific.The Kalanguya Indigenous people protect the forests and watersheds of Nueva Vizcaya in the Cordillera Administrative Region in northern Philippines: Image: Yves Picq, CC BY-SA 4.0, via Wikimedia Commons"
Aboriginal custodianship key to sustainable wild sandalwood management,"Wealth Generation is a fundamental objective of colonisation, and is primarily generated through the extraction and exploitation of resources away from First Nations people’s and concentrated into the hands of settlers and their corporations.The extraction of resources in Australia is not limited to what can be blasted and dug out of the ground, it can include what grows on top of the traditional lands of Aboriginal people.Since 1845, West Australian native sandalwood has been a significant resource for colonial governments and corporations— today, It now represents an important opportunity for financial independence for the First Nations people.Sandalwood has very high economic value, the oils in the wood are in high demand and lots can be priced at $US15,000 to $US17,000 per tonne.The Aboriginal-owned and run sandalwood industry is gaining momentum with investment from native title communities and enterprises, and WA Government support.There are calls, however, for the industry to shift to plantation grown sandalwood only and to phase-out of wild sandalwood harvesting altogether in WA.This could severely impact this promising economic development avenue for First Nations communities on sandalwood country.Colonial settler business and government interests for more than a century have severely depleted sandalwood populations, while in parallel these stakeholders are also investing in plantation sandalwood for further profit.In contrast, First Nations people are being deprived of the opportunity to derive sustainable income from their lands.Should these recommendations be followed, this would be in direct contravention of United Nations Declaration of the Rights of Indigenous People —of which Australia is a signatory.These recommendations do not consider the sustainable sandalwood harvesting practices of traditional custodians of this highly valuable and ecologically significant resource.Traditionally, wild sandalwood was harvested by Aboriginal custodians within spiritually defined relationships and linkages defined by the Dreaming and as an ecologically significant species offering cultural, food and medicinal properties.Today, wild sandalwood is also harvested for commercial purposes—such as the production of fragrant oils for use in cosmetics and pharmaceuticals, and timber used in incense.“First Nations people are being deprived of the opportunity to derive sustainable income from their lands”The sustainable harvesting and seeding practices of wild sandalwood by First Nations enterprises are recognised and respected internationally and locally. First Nations relationship with sandalwood species is not simply about business, it is also a spiritual and cultural responsibility.Recognising the sustainable practices of Aboriginal custodianship, the WA Sandalwood Taskforce recommended in 2020 that the annual quota of wild sandalwood harvest for Aboriginal groups be increased from 10 to 20 per cent of the annual wild sandalwood harvest.Indeed, greater access to harvest already dead sandalwood trees on traditional lands is the ultimate sustainability story and an important value consideration for the end users of sandalwood products—such as emerging ecologically aware markets and consumers.It has recently been estimated that the population of Australian sandalwood trees has declined by up to 90 per cent since the advent of commercial harvesting.What is certain is that the wild sandalwood population is dwindling as a direct result of non-Aboriginal commercial harvesting.In addition, colonial forms of agriculture have resulted in the unintended consequences for the ecosystems that sandalwood trees exist within.Non-Aboriginal harvesting and illegal poaching has led to major vulnerability of wild sandalwood resulting in calls to restrict the harvesting of sandalwood to plantation-grown only, thus halting all wild harvest and effectively reducing the allocation afforded to Aboriginal communities to zero. It was also recently declared an endangered species by the International Union for Conservation of Nature.While on the surface this may seem to be an apt response to this ecological crisis, we argue this response reflects age-old colonial settler inherent biases and tactics of unsustainable wealth extraction of natural resources, without reference to or respect for the sustainable harvesting and seeding methods practiced by First Nations Aboriginal communities—who are the custodians of these wild-growth sandalwood trees.First Nations communities within the WA regions on whose lands wild sandalwood has grown, prospered, and been sustainably harvested for millennia, are also amongst the most economically impoverished in Australia.In the shifting of all sandalwood harvesting from wild to plantation grown populations, largely non-Aboriginal interests are to benefit from the extraction of this resource, while for Aboriginal enterprises and communities this avenue for sustainable socio-economic benefit is being removed altogether.Under Aboriginal custodianship, sandalwood thrived for thousands of years prior to European colonisation and exploitation of the tree population by non-Aboriginal interests.Traditional Owners and native title holders argue that custodianship, development and management of wild sandalwood trees must be ceded to First Nations people for whom these trees are growing wild on their traditional lands."
